title,selftext,upvote_ratio,ups,score,num_comments,subreddit
Joint pain after returning from long hiatus?,"Basketball was my first love, and I abruptly stopped hooping after high school. Nine years later, at 28, I recently just picked up a basketball again and tried regaining my jumpshot on a raggedy basketball goal out in the street. 

But I feel like I'm 40. My knee pain during jumps and ankle pain during dynamic movements is quite unbearable if I'm doing anything other than freethrows-- I can't even jog to track down the ball without severe knee pain. And I was just jogging on a treadmill without knee pain this past winter before I stopped hitting the gym due to covid. 

Why would my joint pain be this severe? I've been shooting hoops for about a week now trying to shake it and I can't. Do I youtube foamroller techniques or what exactly can I do to get my joints healthy? Joint supplements? Daily jogs?",1.0,1,1,2,Basketball
Rec ball in Maryland?,Anyone know of any rec adult leagues in md preferably Eastern shore area,1.0,1,1,1,Basketball
Need help with training schedule. I want to train every aspect of my game.,"Hey guys, i need some Help and suggestions. I play Point/Shooting Guard, And need help with a schedule. The things I want to improve are: Shot, Dribble, Speed, Explosiveness, Vertical, Muscle mass, Weight, Stamina, flexibility.

I want to become the best player.
I already work everyday for it but I find it hard to do vertical training run long distances improve speed And gain weight. I can’t shoot everyday because my legs are sore so can’t jump up anymore. Does anyone have suggestions on how I can improve all of those things without. Falling behind on 1 thing.

Thanks for reading, and if you have tips I would love to hear it.",1.0,3,3,3,Basketball
Chennedy Carter Career-High 26PTS vs. Phoenix Mercury - 8.4.20 | WNBA 2020,,0.78,5,5,0,Basketball
76ers' Simmons exits game with left knee injury | NBA.com,,1.0,1,1,0,Basketball
how much points do you prefer to play up to in 1 on 1?,i usually do 11 1 and 2s or 13 1 and 2s,1.0,1,1,8,Basketball
Fans react to Pacers' T.J. Warren engaging superhero mode in NBA bubble,,1.0,1,1,0,Basketball
A whole different animal.....,"Dear middle schoolers, high school basketball is a whole different sport than junior high or rec ball. Last year (8th grade), I was a total chad. 6’1, 150 lb point guard, 20-35 points a game, averaging a triple double, ect. 

Now, I’m benchwarmer on JV. Everyone is bigger, faster, better, stronger and *THEY WILL NOT WAIT FOR YOU TO CATCH UP* .Harder drills, rougher coaches, INSANE pressure every time you step in the gym. 

Just a warning, guys. You have to be dedicated to the game if you are going to have any success whatsoever. Thanks for coming to my TED Talk",0.96,158,158,40,Basketball
Quickest Way to Gain 4 Inches of Vertical?,I don’t know and exact number but I’m somewhere between 3-5 inches away from dunking. What program or exercises would get me there the quickest? I’m a one foot jumper,1.0,3,3,4,Basketball
Screen Recording NBA Games,"Does anyone have issues with screen recording NBA games from League Pass?? Any program that I use (even the iPhone screen recorder) just produces a black screen with audio. If I record anything else, YouTube, PowerPoint, etc it works fine but as soon as I try League Pass it goes black.

Has the NBA blocked their videos from being screen recorded?? It used to work before the covid break.",1.0,4,4,4,Basketball
The phrase “make teammates better” doesn’t really make sense to me,Just cuz you find your teammates or get them to certain spots with your passes doesn’t mean you’re “making them better.” It just means that you’re a good playmaker. I don’t think the phrase should be used in the context of being a good playmaker.,0.5,0,0,3,Basketball
I need to improve on my three pointer.,"Every upvote this post gets, I have to make a three pointer. ",0.55,1,1,4,Basketball
Tips on coping and calming down during high pressure situations,I'm a pass first point guard and I always choke whenever I have a fed up teammate and/or teammates. I would consider myself to be decently clutch under end of games but I cannot stop myself from choking passes or shots whenever I have a teammate who's pissed off with me or just pissed in general. Maybe because I'm just a people pleaser or maybe there's a way I can get rid of this problem that's keeping me from my true potential. I'd appreciate any tips or criticism that come my way,1.0,1,1,5,Basketball
Any dribbling tips,"I’m making the transition from C/PF to Small Forward and I’m trying to learn how to dribble so I can create a shot, drive, and overall be more of a threat on offense. Any tips or tutorials will help

I’m 15, ~6’9, 220 lbs if that helps any",1.0,7,7,7,Basketball
Do u think it's possible to be explosive without being fast,"As a shooting guard, my skill set is shooting, defense, and driving to the basket aggressively. Basically all around scoring. I'm 5'11 and 160 lbs. I can usually get past most people with my first step and finish with my strength. When I play people, they're usually faster when it comes to sprinting/running/doing drills, but when it comes to 1v1, I easily get past them. I was told that a quick first step is not all about speed, but also about explosiveness. Do u think it's possible to be explosive without being fast?",1.0,3,3,5,Basketball
Need some thoughts on my vert,I am a 5'4 8th grader that plays point guard what is the average vertical for that age group because I did some research and couldn't find anything based on that.,0.86,5,5,9,Basketball
I would like tips on how to properly shoot a fade-away shot.,"I’ve been trying to add a consistent fade-away to my bag for 2 months now, any tips on how to?",0.98,33,33,36,Basketball
"Aye bro’s, I need some advice","typing this on mobile so... formatting. To start im 16, 5’8 and 154 lb. I’m tiny, but in my country the average height is pretty damn low and specially in high school, so much so that I play small forward, the coach for the team has a 5 out type of game but our players don’t really have the 3pt shot down, also our plays are really advanced for our level of play ( fill in the spot ) we would be better off with a 2 in 3 out kinda setup and maybe get some plays that are more dynamic and simpler like pass and screen 
Would it be, like, acceptable if I pointed this out to my coach?
Appreciate y’all",0.72,3,3,11,Basketball
Would like tips on how to do a perfect hesitation move,I am usually the fastest guy on the court so when I want to cross someone up my body instinctively goes into a spin or a fake spin move to shake them off. I realised that adding a hesitation move to my bag would really help slow the game down for me and make my plays more flashier. I have tried practising the hesitation move but I almost always fail them because I did not hang the ball long enough and always forget to read and react to the defender. I would appreciate any tips given,0.76,4,4,12,Basketball
I need some help with my footwork,"Whenever I'm about to shoot from anywhere on the court I feel like the momentum just gets sucked out from my feet. And I am aware of how I should be lifting my heels beforehand (I'm always lifting my heels before a shot). But I think that my running technique is the problem here. Whenever I'm running, should I put my weight on my heels or or the front of my foot for each stride? Because I'm one of those players like Paul George (not saying I'm anything near to his level) that really isn't the fastest in terms of pure speed and relies more on balance and footwork. Any advice would be truly appreciated. Thank you.",1.0,6,6,3,Basketball
Bought a new ball - Doesn't bounce enough?,"I just bought a new basketball intended for outdoor use, I went with the Molten BG3200 Indoor/Outdoor Composite. My issue is that it doesn't have enough bounce - I really have to pound it hard to get it back up. I've inflated it to the point of almost overinflating it just to get enough bounce out of it, any less and it just won't bounce. Will it get better with time? Is it simply an issue of the ball having to be played in? 

Does anyone have experience with these balls? Appreciative of any help.",1.0,8,8,3,Basketball
Any workouts to improve my vertical?,"I'm 5'11 and my teams center, I was looking for some workouts to improve my vertical so I can get as much air on my hook as possible.",0.81,3,3,5,Basketball
"Today I started training basketball from zero and I'm doing this, its ok?","Hi, I'm a total newbie who wants to start learning from zero, I just want to practice every day doing this training, what do you think? should I add/remove something?

Dribbling static one minute each hand (6 minute total)

Dribbling walking one minute each hand (6 minute total)

Crossover dribble static (5 minute)

Low dribble fingertips on the floor one minute each hand (4 minute total)

Running dribble one minute each hand ( 6 minute total)

&amp;#x200B;

Also do you know any app with a training routine for newbies?",1.0,3,3,4,Basketball
"Going into high school this year, any advice for a player on the shorter side",Going into high school this year and I’m planning on trying out. Does anyone have any advice for what would help my chances of making the team as a smaller guy,1.0,2,2,6,Basketball
"Im going to High school, any tips for tryouts?","I know Covid might ruin the basketball season, but can i get some tips for tryouts and in game for high scchool?",0.99,74,74,30,Basketball
What's a good upper body workout for basketball?,,1.0,3,3,1,Basketball
Is there anything I can do to be a better big man,"I’m in 7th grade and really tall but I don’t have the skill set of someone who plays tall. I don’t have post moves, rebounding or anything like that. I asked my coach to put me at PG/SG which is what I played before hit my growth spurt but he really wants me to play center.",1.0,2,2,12,Basketball
How do you not get discouraged and/or angry at yourself?,"Hey guys,

So before the pandemic started, I wasn't that good at basketball. I was okay, but nowhere near my friend's level. Ever since the pandemic started, I've been going out to my local courts at 6:30 am and working out for an hour and a half. I can tell I've really improved and my friends noticed it too. The past four days I haven't been able to practice because of a family emergency, and I just feel really down about it and I'm really pissed at myself for not playing ball or practicing.

Does anyone know ways to cope with this or have any workouts you can do at home?

I know its a long shot that anyone here can answer this, but I don't want to give up on another dream.

Thanks",1.0,2,2,4,Basketball
Inner Game of Tennis,"Just finished the inner game of tennis yesterday, and I would like to say that that book has personally completely changed the way I played basketball. Originally, everytime I stepped on the basketball court, I would play under so much pressure that I would fold the ball over. I was always really good at scrimmaging and practicing, so I managed to make a circuit team. However, I would always over think in games and choke. After reading this book, I have finally understood how to truly play in game. Played a adidas gauntlet team yersterday and got my first double double. I know there much to improve on, but my performance has skyrocketed ever since reading the book. I highly recommend this book if you struggle with this problem like I do. I have been struggling with performance anxiety for 5 years, and I cannot tell you how great it feels to finally overcome this struggle.",0.84,4,4,0,Basketball
Shot consistency,"I practice my shooting almost every day, but some times I’ll have pretty decent shooting and some days I’ll struggle to make a shot. Also my form is different for almost every shot I take. Any tips or drills to fix it?",0.88,6,6,5,Basketball
Is it possible that Spalding Lost its weight?,I got Spalding Indoor/Outdoor control grip February last year and recently I started realizing it weights significantly less than my friends balls. Now I'm not sure if that was the case since the beginning (I think it wasn't but what do I know). Any ideas what could happen or is it just me going crazy?,1.0,2,2,3,Basketball
My forearm hurts just under my wrist after repeatedly shooting the ball,"Is this common? Its the first time its happened to me and ive been training for like 6 months... is it a technique issue? Cuz ive filmed myself shooting to try and improve my shot but nothing particularly stood out... help?
Edit: i feel like i fling my wrist whenever i shoot, could that be it? How do i fix that?",1.0,3,3,7,Basketball
Advice for dealing with coach and situation?,So I am a scoring shooting guard(very similar to Lou Williams). Coach benches me. I don’t understand. I averaged 22 a game with 1 ast and 3 rebounds.,0.77,7,7,48,Basketball
Does anyone have good plays to run,I need to improve my playmaking skills. I'm practicing to look up the court all the time to pass or call for a pick but I'd like to run plays while looking for open teammates so please leave some plays down below and leave a description. Thanks,1.0,2,2,6,Basketball
if a player was traded during mid season and the team that trade them won the title. will the player have to accept the ring to be consider a champion or is it auto?,"lets say the kawhli and demar trade happen mid season then toronto wins the title

does demar have to accept the ring for his wiki to say he is a 1 time champion or is it auto since he was part of the team during the season",0.75,2,2,1,Basketball
AAU Basketball Question,"
During the pandemic my school has been wondering how to properly set up athletics program, and they at one point considered not doing it at all. But parent tried to threaten them by saying they’d let there kids play for other teams and leagues such as AAU. Which made me wonder do you have to be good to play on an AAU team or can you just join? Also if you can just join us it like school teams where everyone gets to play a little or does it at that point become all about winning (not a bad thing) and they only play the best players?",1.0,2,2,6,Basketball
Has anyone tried this basketball?,,1.0,1,1,3,Basketball
In confusion,I’m a young sophomore who’s 15 and I don’t know if I would play 15u or 16u for aau this upcoming year. I just think that since 16u is for sophomores should I play 16u or should I go with age and play 15u?,1.0,1,1,0,Basketball
Just watched my first Jordan game and I'm in awe,"I've been watching basketball for years but never stopped to watch an entire game from the man himself (or any old/legendary game), and today I decided to do just that, a 55 point MJ one against the Knicks (Ewing was amazing too) and not only the game dynamic was different, it flowed a LOT better, as there were fewer pauses and fouls, there was more *game* in the game, and Michael's playing is out of this universe

I'm amazed on how different (and in many ways, better) basketball was in general. Even the broadcast and image were a surprise, it had a certain glare, and the crowd, soundtrack, and the overall scheme was so surprising, it was a beauty to look at, visually, one of the prettiest things I've ever seen, it's stunning. 5 hours later, I'm watching a Rockets x Bucks game and I can't help but feel that ""it's great but not the same thing"" feel in the back of my head (the absence of a crowd doesn't help a bit). 

I know we have the second best ever with LeBron today, but it's like something was lost with time, it doesn't get as ""grand"" as this old Bulls X Knicks game felt to me. Idk.

If you feel like it, recommend some legendary games for me to try and find through the internet to increase my knowledge of the greats before the 2000s",0.94,75,75,25,Basketball
Sophomore trying out for varsity(high school).,So you  guys have any tips on how I could raise my chances of making it?,1.0,1,1,6,Basketball
What is my follow through supposed to look like?,My follow through looks super awkward looks like conjointed twins on my fingers,0.67,1,1,1,Basketball
"The National Basketball Federation of Kazakhstan became a partner of the international socio-sports platform IUNGO. IUNGO is a new mobile application that is a global tool for sports marketing and digital technology, used to provide many different opportunities for athletes",,1.0,1,1,0,Basketball
"r/Basketball Weekly Discussion: Basketball Shoes - August 03, 2020","#Welcome to /r/Basketball's weekly Shoe Discussion thread!
   
##Got a question or need some buying advice?  
This weekly thread is for discussing the best shoes for YOU based on type of play, environment, price point, etc.

##Excited about that new Adidas or Nike line?  
This thread is also for getting hype for the next big sneaker.
   
*Moving forward, please post all individual shoe threads as a comment here, both for organization and record-keeping.*",1.0,5,5,5,Basketball
Chicken wing elbow foul?,"
In a 1v1 situation, am I allowed to keep my offhand elbow out while driving? If the defender is on my left side, my elbow kind of stabs them in their chest/stomach area so they back up allowing the free layup (but I don’t swing my elbow at them, it’s just sticking out on my side). Is this legal?",1.0,1,1,1,Basketball
My vert has plateaued??,"So I'm a 5'8 16yr old with a 7'5 standing reach and one of my main goals has been do dunk on 10 ft, and i mean to bang it, not just a light rim grazer. Over the quarantine i got a vert increase of 9 inches and am currently sitting at a 34 inch vert  where i can comfortably touch and sometimes grab the rim off both 2 and 1 foot. Now this is the tough part, I have been stuck at this point for about a month and it's mentally draining to see you're not making progress anymore, can anyone advise me on how to either win the mental game with myself about this or to get over the stage of rim blocks, preferably both though ;)",0.98,78,78,29,Basketball
Rap spotify playlist for shooting hoops with friends?,"You guys got any good playlists that I can play on my speaker? Spotify preferably

Thanks in advance",1.0,1,1,4,Basketball
Im making progress,"I finally touched the rim today, ive been doing vertical jump exercises and its started to pay off i was so happy to finally touch the rim another step closer to dunking. I know it aint very impressive but im so happy!!!",0.97,24,24,8,Basketball
Kelly Loeffler's White Supremacy Tour Continues - It's Time for the WNBA to Dump Her,,0.72,3,3,3,Basketball
I’m finally seeing inprovement,"Yesterday I played my first game of pickup since quarantine started, I had been working out all summer trying to improve my game and it payed off. Normally I would get the ball stolen when I tried to dribble but this time I felt more confident and everything that I practiced just came naturally in game.",1.0,5,5,2,Basketball
NBA League Pass issue,"I usually watch the games the next day because I live in Europe. I also hide the scores in the apps settings but now after a while I've started to notice when a game goes to overtime (or doesn't).

Since the game is already finished, it's like watching a video on YouTube. But when the video is close to the two hour mark it's almost guaranteed that the game went to overtime. If it's over two hours that 100% it's overtime.

On the other side, when the length of the video is around 90-100 minutes then you know the game ended in the regular time. Even though in the end I don't know who won the game, it takes the excitement out of the game in the end when you know if it does/doesn't go to overtime.

I've searched around and there doesn't seem to be a way to hide the length of the video and it's becoming frustrating.

Just wanted to see if someone else encountered the same issue.",1.0,1,1,0,Basketball
Have u guys experienced a hurting soleus before?? The inside one,"If so how many days did it take for the pain to go away?? I got mine from suddenly jumping too high on my right leg(the pass was pretty high) then i got a muscle cramp immediately on my calf which after then been hurting for a while now, my soleus that is. Only when i run though",1.0,1,1,0,Basketball
1 foot jumping problems,"When I am jumping off 1 foot when I put too much weight on the left leg my left knee will start to hurt. If I put too much weight on it the knee will hurt for the rest of the day. Is this normal? If not, what can I do to prevent it?",0.81,3,3,0,Basketball
Rule Check: Can you stay on one foot in last step of layups?,"Can you theoretically stay on one foot for as long as you want in layups? the rule is you have to shoot or pass before you land your last step. Can I take my time before I shoot or pass as long as I don't land my other foot? if someone fly by and trying to block, can I stay on one foot then shoot or pass? Does layup have to be continuous motion?",0.83,8,8,5,Basketball
is it in a illegal screen to block someone by boxing them out mid play?,"for example, let’s say i’m driving towards the basket from the left wing, and i see that i have a wide open team mate in the left corner. i dish it out to him, and i see the guy that was guarding me is now running to my teammate to contest the shot. 

can i stretch my hands out and get in a low position (as if i was boxing him out) to prevent him from being able to run over to the corner?",1.0,3,3,5,Basketball
How do I get handles and ball control like Iverson?,"How do I get fluid handles like Iverson? For example, His fakes, his ability to stop on a dime, his ball control all around his body, his dribble penetration.",0.67,1,1,5,Basketball
I was wondering if there was a limit on how well you can handle the ball.,Like how good do your handles need to be for high school or college...,1.0,5,5,7,Basketball
Kyle Korver or J.J. Redick? Who's better?,"They seemingly have the same damn role on their respective team - wait for the 3-point kickout, knock it down, and play the best D you can at your advanced age.  So who's better, and why?  (Team record doesn't matter, unless you think either is a big factor in that record - I don't.)",0.67,1,1,4,Basketball
Increase my chances of being 6 feet,"I’m 15 and 5’10, is there any stretches you guys recommend to grow to at least 6 feet by my senior year?",1.0,1,1,3,Basketball
Does it mean I suck if I couldn't make JV as a Junior?,"I've been feeling bad since December when I didn't make it. My school is pretty good at basketball, we won 2/5 last state champs, but I got cut from JV this year. I had a bad tryout, and I feel I'm better than at least 1/3 of the JV team but I don't want to use that as an excuse. Anyway, does it mean I suck if I couldn't make the team?",0.6,1,1,10,Basketball
I need help with basic nba knowledge,"Im in my school basketball team but i only like to play Not watch

So ive always been embarrassed when asked questions such as Whos your favorite player or whats your favorite team

So tomorrow im doing something (doesn’t matter what it is) And i know that im going to be asked a lot of those types of questions so could you fill me in?",1.0,3,3,3,Basketball
LeBron James and kawhi leonard to both score over 25 points. Is that a good bet to take?,I don’t know that much about basketball. Is this a good bet for tonight’s games?,0.95,85,85,18,Basketball
How can I fix my jumper?,So I’m having a problem with my jumper that I can notice I’m still using my left hand (my guide hand) so also propel the ball when I shoot. I tend to flick my thumb and use my left when I see all the great shooters not using their left at all. I’m a couple months past my 15th birthday and I’m worried that somehow I’m not strong enough to shoot with just my right. Do I need to sit in a weight room? Or do I need to sit there and do form shots and find a drill that’ll help me lose my left hands habits? Sorry for the long ass paragraphs but I’m curious and unsure about my jumper.,1.0,2,2,6,Basketball
NBA Underdog Bets (8/2/20),"Which NBA underdog has the best chance of pulling off a win tonight?

[View Poll](https://www.reddit.com/poll/i2eye6)",0.5,0,0,1,Basketball
Struggling with a consistent release,"For the past few weeks, I have been struggling with my shot. I've already gotten my one motion form down but I need work on keeping a consistent release. Some days I would be lights out and other days I would brick like. I'm a middle finger shooter but I do have some interference with my ring finger so how can I fix this. So any tips or drills?",1.0,10,10,4,Basketball
I finally find out the dribble package that's for me :'),"I have really long skinny arms and as a result I always have a hard time dribbling because I was always taught to have ""tight handles"" but I always have a hard time doing it because of my arms. So I started loosening up my dribble like Allen Iverson and it worked like a charm because I use my arms as an advantage instead of a weakness by making my crossovers a lot more bigger and using my foot work a lot more. Which means now that I can defend, shoot, and now handle the ball :))",0.67,1,1,0,Basketball
Which Position?,"Im 1,83m (6,0ft) tall

I want to play in a under 16 basketball team and the tallest guy there is 1,86cm (6,2ft)

Im good at layups, rebounds and defence

Im absolutely trash at shooting in any way (near or long distance)

Now which Position should i play?",0.6,1,1,5,Basketball
are you the go to guy when your team needs some quick buckets to get back in the game?,starting to no longer be that go to guy,0.67,1,1,1,Basketball
