title,selftext,upvote_ratio,ups,score,num_comments,subreddit
How to translate my skills into real games,"All those hours of grinding...I am still not seeing the result in real games!

Last month I attended a couple of basketball tournament, and I've found that I can't translate my skills in real games when playing against defenders on me. I am a guard and a very good ball handler that can pull up mid-range shots pretty well, but during the games I was frozen and my head went blank all the times against tough defenders and had to pass the ball to my teammate that can attack the rim. 

This has made me start doubting myself if I should not spend hours practice those drills alone and also made me start losing confidence recently because I feel like all those hours and grinds I've spent are not showing...The worst part is that I know my skills are better than many people out there but I am less useful when it comes to real games. This sucks.

I practice alone a lot on daily basis after work, and I don't screw around just shoot for fun. I've been grinding my ass off. However, I rarely play real games with others. I know I should play more against people but most my teammates live far away and not many people play basketball in my hood... 

Please give some advises on how I can translate my skills into real games?. I want to play the way that I know I am capable of.  Thanks guys.",1.0,3,3,2,Basketball
Why are your thoughts on having 5 scorers on the court at a time (aka no point guard),I am a shooting guard that has never gotten more than 3 assists in a game and coach puts me at PG. I am not sure what to do besides go iso and try to score. Does not having a natural point guard on the floor negatively impact the offense?,1.0,1,1,3,Basketball
How do you practice 3's without shooting 3's?,"I have been at a sort of plateau recently. My 3-pt shooting is always between 23-25%. No matter how may times I go and shoot 3's, I can never seem to get this percentage up. I've toyed with my shot a little to try and fix any lingering bad habits (not loading up, not fully extending, not snapping my wrist, etc..) but I'm kind of at a brick wall. It would be nice to become a better shooter, but besides just sitting there and shooting endless 3's, is there anything else you do to improve your 3-pt shot game?",1.0,1,1,3,Basketball
How to increase my vertical?,"Can anyone help me increase my vertical, 3-4 inches more and I'll be able to do a clean dunk. I am 17 so I can't buy a jumping program.",1.0,2,2,4,Basketball
Looking for 30 for 30s,Do you know where I can watch 30 for 30 documentaries?,1.0,1,1,1,Basketball
Why are so many multisport clubs in euroleague?,"Is it a good thing for euroleague teams to be associated with football clubs? Clearly the football department is much more famous. Should they have their own separate identity? Does being connected to real madrid, Barcelona, cska Moscow or fenerbache help or hinder them? Who would someone from Madrid who supports atleti follow in basketball? Surely they couldn't support a real madrid team? And then how does it affect things like shirt sales etc",0.94,21,21,4,Basketball
Is there a rule stating you cant grab the ball from behind an opponent?,"Any rule in nba, ncaa, nfhs, fiba stating one cannot grab the ball and ball only from behind an opponent? First time someone called that and i'm confused.

Also any rulebook stating you cannot press the ball (ball only) of ballhandler when taking a shot coz i'm pretty sure this is some urban legend rule that  came out from grade schools. Coz to me it should be a clean block.",1.0,1,1,15,Basketball
All those hours of grinding...I am still not seeing the result in real games!,"Last month I attended a couple of basketball tournament, and I've found that I can't translate my skills in real games when playing against defenders on me. I am a guard and a very good ball handler that can pull up mid-range shots pretty well, but during the games I was frozen and my head went blank all the times against tough defenders and had to pass the ball to my teammate that can attack the rim. 

This has made me start doubting myself if I should not spend hours practice those drills alone and also made me start losing confidence recently because I feel like all those hours and grinds I've spent are not showing...The worst part is that I know my skills are better than many people out there but I am less useful when it comes to real games. This sucks.

I practice alone a lot on daily basis after work, and I don't screw around just shoot for fun. I've been grinding my ass off. However, I rarely play real games with others. I know I should play more against people but most my teammates live far away and not many people play basketball in my hood... 

Please give some advises on how I can translate my skills into real games?. I want to play the way that I know I am capable of.  Thanks guys.",1.0,2,2,1,Basketball
High school Basketball season coming up (hopefully) need help with conditioning...,"This year 150 kids are trying out and I’m not trying to lose my spot, anyone has tips on what conditioning drills I should do?",1.0,3,3,5,Basketball
my progress is .....,"Lot of progressions made in the last couple of weeks! Just grinded every day and did what I love!! I want it to be a project about motivation, showing what I do to get better in basketball, I am not a  professional, but that's why we started. To show you our journey and progress.  

Just keep working guys! check me on IG: @ esseathletes",1.0,1,1,0,Basketball
I don’t know what’s wrong,"I recently went to a camp over the summer and I worked the hardest I’ve ever worked. At this point my knees hurt really bad whenever I run and jump. I’ve had ice baths, bio freeze and it’s been about a month since I got back. Anybody know what it is or how I can get rid of it",0.79,5,5,16,Basketball
Any tips om 360 dunking?,"I am a one legged jumper, I find it hard to spin correctly, also where should the take be?",1.0,1,1,0,Basketball
Any advice to counteract basketball net vandalism?,"Hey there!

Me and my buddy started playing some basketball again on a nearby court. The court is relatively new and everything but the nets got damaged by vandalist people. I know even if I buy one myself(metal or rope)and put it on there it will be damaged in a few weeks maybe even days! How do you counteract this in your home court?",0.84,4,4,3,Basketball
Who you taking to start a franchise?!,"Cp3 or Russell Westbrook?! 
Me and my friends are having a argument on who we’d take can I hear some of y’all reasons would like some of y’all insight and opinions!!",1.0,1,1,0,Basketball
What's the best outdoor court surface?,Anyone aware of a suitable product that can reduce noise but still provide a good bounce?,1.0,1,1,0,Basketball
Questions. Is it really that hard to mark or defend against someone in basketball?,I just started following basketball and I enjoy the sport. I even like to shoot the ball occasionally. One thing that confuses me though is how the players don’t defend better. I understand that you can’t reach but I’d assume you just stand in front of a player with your hands up and contest shots. Is it that hard to stop someone from bouncing a ball past you especially when they can only score in a rim/hoop with a diameter slightly bigger than the ball itself? Also some nba players don’t look particularly fast (like James Harden or Luka Doncic). How are they scoring so much?,1.0,3,3,3,Basketball
"r/Basketball Weekly Discussion: Basketball Shoes - August 31, 2020","#Welcome to /r/Basketball's weekly Shoe Discussion thread!
   
##Got a question or need some buying advice?  
This weekly thread is for discussing the best shoes for YOU based on type of play, environment, price point, etc.

##Excited about that new Adidas or Nike line?  
This thread is also for getting hype for the next big sneaker.
   
*Moving forward, please post all individual shoe threads as a comment here, both for organization and record-keeping.*",1.0,5,5,16,Basketball
Is dunking like Jalen Green that easy?,"Hello guys I am 15 years old and i am 6'1, 70 kg. I just watched some vertical jump program review such as vert shock, vert code etc. And the dude gained like 4 inches, and that brothers me. I just started doing vertical jump bible and i am worried if i am going to see any results at all. The guys that are testing these programs are young but they dont train basketball now does that have any effect on the bounce. What do I do, I just want to jump high like Jalen Green.",1.0,2,2,9,Basketball
Legendary Georgetown coach John Thompson Jr. dies at age 78 · Sportsa,,1.0,3,3,0,Basketball
Basketball Coach Opportunity,"Hello, I have a startup that consist a of bringing our basketball players to the highest level of competition. 

I’m hoping to find some energetic coaches that love to be on camera and truly love to help hungry athletes 

Whether you’re interested or know of anyone I’d love to go more in depth!",1.0,2,2,0,Basketball
How can I get more power in my 3 point shot?,I need help getting more power into my shot. What exercises can i do to get more power into my legs/forearm so that my shot goes farther? any tips on how to shoot farther/ accurate range?,1.0,1,1,6,Basketball
Books on Basketball essentials - with images,"Hi,

I got into basketball recently and I'd love to get a book with plenty of images (preferably photos but illustrations are cool too).

I am not interested on the history of the sport or biographies of players. I am looking for a book that shows the essential moves, gives advices on exercises to improve, etc. 

I would particularly love player movements broken down in sequential images.

I searched on the internet and found something that is close, it is titled basketball anatomy, the illustrations shows key muscle groups and stuff, but it is more focused on strength training for basketball players. So it looks not bad, bad too niche.

I wonder if basketball for dummies would fit my expectations.

Anyway, if you have any suggestions, I'd love to read you.

Thanks in advance!",1.0,1,1,0,Basketball
How do I get recruited to play aau in middle school,Ok so I know with this pandemic and everything recruiting has been put to a halt and most coaches and scouts can only like email or something like that but can someone in the comments who's had experience with aau run me down on how the recruiting works,1.0,2,2,3,Basketball
Coach gives me wrong role,I’m 6 foot 1 and I’m 17... I play rec leage cause my high school is full of politics. I’m usually one of the tallest on my rec team so my coach will throw me in at the center position and will get very mad if I come up to the top of the key. I have to be positioned underneath the basket.... i want to grind so I can get to a d1 level without playing in high school. How can I convince my coach that I should play shooting guard and have smaller players play center,1.0,3,3,8,Basketball
My Vertical Journey,"I’m a 182LBS (83KG) 6ft Caucasian (if relevant) male with shortish legs proportional to my height and long arms. 
I can bench press 265Lbs (120KG)ish 
I can squat 330Lbs for 6 reps (150KG)
I can deadlift 452Lbs (205kg) for a single
I have been training more Plyometrics recently including variations of box jumps/reactive jumps/tuck jumps/some sprints here and there etc etc 
I can dunk off two feet from one step on a 9.5ft rim so I feel I’m pretty close 
I would like some advice on how to get that last couple inches! I was thinking to lose a little weight? As my strength is already there and I won’t be able to hop in the gym and do some squats and see instant strength results as I’ve already been training a couple years (I’m 19 years old by the way)
Also as I said I can jump high off two legs but not as well off one! In addition i don’t feel like I see a huge difference when running up to the rim instead of taking a one step before my penultimate. 
I know I’m rambling but any comments would be appreciated!! 
Have a blessed day",1.0,1,1,0,Basketball
Vertical and dunking,"My brother is currently a senior in HS and wants to know if he can dunk. He's 5'9"" and has a 34-inch vert (not standing) and can touch the rim. He doesn't specifically work out or do exercises for his vert and just plays basketball for fun. I'm pretty sure he has the potential but he doesn't believe me. Just tryna prove him wrong😂😂",1.0,1,1,1,Basketball
Pick up games defense,"Pick up basketball defense

I’m new to playing basketball again, but I know how to play and I’m pretty good. When I play fullcourt I get a lot of fast break points because I hussle and I play lock down defense , I don’t foul or anything rough but I play good defense. I got a chase down block today for example. Do people get mad when you play good defense like that? Or should I play more casual ?",1.0,2,2,1,Basketball
The Story of the 2016 Chino Hills,,1.0,2,2,0,Basketball
Two steps and then fake?,In a pickup game yesterday I took two steps after dribbling and then did a sort of dream shake move. I shot faked and then put it up after. Is this a travel?,1.0,1,1,6,Basketball
Improving my handles,What drills should I do to improve my handles,1.0,1,1,1,Basketball
Was watching a Jlawball video and he was talking trash on the “Wilson Evolution “ ball. What’s so wrong with it that’s the ball I use !? He claimed it was a “cheat code” wtf does that mean ?,,1.0,1,1,1,Basketball
How do I make my dunks look good?,"So I’m a 12 year old 5’8 130 pound kid and usually play for fun but play serious a lot too,  I’ve grown up watching Vince Carter and Westbrook dunk highlights and that’s what really started my love for the game. But when it comes to dunking myself, I look pathetic, I have a 19 inch vert , but I can graze the rim on 8ft, I can’t palm the ball just yet considering my hands are 23 cm, when I play for fun I usually do it on 6’5 net so I want to learn to make my dunks look better, my feet stay flat when I’m in the air but I’m trying to break that habit, I’ve heard it’s better to arch my back so that might help, if you guys know anything that could help thank you! 

Ps: I can’t post pictures on my phone, so I can’t show you what it looks like",0.96,85,85,29,Basketball
Intercepting an alley-oop pass and goaltending.,"It has been perplexing my mind recently. What if a player throw an alley oop pass near the basket and opponent intercepts it, will that consider a goal tend?   


\- If yes then why?   
\- If no, what if the opponent didn't intercept it and the alley-oop happens to be a straight bucket by chance if no one touches it?",1.0,1,1,5,Basketball
How do I get into coaching?,"I’m currently going into my senior year of high school, and I would love to coach a youth team in the next year. I have 2 years of experience as an assistant, but I used to play for the head coach, so he gave me the opportunity. I understand I may be too young, but I was wondering if there was any way I could be the head coach of a team without starting my own?",1.0,1,1,0,Basketball
training to increase the jump?," I want to increase my jump to get more things done in the game, help me!",1.0,1,1,0,Basketball
My goal is to play in the NBA,"Title, but the problem is I live in another country, and the only way to get to the nba is work my way through college in the US, I still have 3 years of hs but how can I get more exposure, how do I make a highlight tape, and how do I get the college I'm applying for to scout me, also I need it as a scholarship because my parents can't pay fo my tuition fees.",1.0,2,2,2,Basketball
Does basketball actually make you taller?,"Ok, I no this is a really stupid question but like does playing basketball actually make you taller? Cuz I’ve searched that answer up and it said basketball players are tall cuz it’s in their genes and I don’t no if the internet was dumb or if it was just me like always lol. But anyway does it?",1.0,2,2,5,Basketball
I don’t want to play bully ball anymore,"Whenever I try something and it fails, I go right back to bully ball. I want my game to be more like Anthony Davis, Joel Embiid and Hakeem Olajuwon. Where should I start?",1.0,1,1,1,Basketball
"Blazers, UConn star Clifford Robinson dies at 53",,0.91,8,8,1,Basketball
How to get signed/tryout for any ACB team?,"Not going to go into any details, i don't like to gloat at all, so i'm gonna keep it short and sweet. i know i have what it takes to play professional basketball. As of now i'm playing college basketball as a league standout player in the US. I'm going to transfer overseas to Spain and i'd like to have a shot at a professional basketball career beginning there. 

Any coaches, players, ex-players, front office/team ops or just anyone who knows in general have any idea or could offer any advice/help?  

I hope everyone is staying safe during these times, and i'd like to offer my thanks in advance!",1.0,7,7,8,Basketball
Shooting help,Hello i am 15 years old and i am 6'1. Recently i wanted to improve my shooting form and accuracy. So is there a good program i can use for improving?,1.0,9,9,2,Basketball
Why can't I get up like my friend?,So me( im not black) and my friend(he's black) do a sort of dunk session a couple times a month. My muscles are bigger and stronger than his. We have identical reach and overall im better built. However my friend somehow gets up significantly higher than me. We both jump off one foot. How is this possible? Only thing thats different between us is skin colour and he weighs like 10  pounds less than me. While hes getting like a 35 inch vert im at a 30. I train my legs in the weightroom while all he does is play basketball. I don't get it. Why is this so?,1.0,1,1,1,Basketball
Barack Obama helped convince NBA players to end their strike and return to play,,0.78,5,5,0,Basketball
What if work my ass off and truly believe in my heart and skills that I’m a division 1 player. But I only have D2 offers and no d1 interest and I don’t feel I would be happy at a D2 school.,"What do you guys think? This might be me being picky but every time I get to matchup with a high recruit I always leave the game with 30 points, I always do good against these top players. But I only have D2 offers and I don’t feel like I would be happy at a D2 school and feel like I’m gonna have to settle for something less then what I’m capable of",1.0,2,2,2,Basketball
"What do you guys think of the show ""Hoops""?",I wanted to get your opinions on that new Netflix show? I dont wanna waste my time if it's bad haha,1.0,6,6,3,Basketball
😑😑😑mfw i figure out bbb is big balls brand,,1.0,1,1,0,Basketball
How to play pro overseas if you’re from america,I see slot of over seas players ask how to play in nba but I haven’t seen any ask the other way around,1.0,6,6,6,Basketball
My brother need your help,"So he's 13, has 23-25 inch vert, fast, and his height is 175 cm and wants to improve his vertical to dunk.  
Any Tips?",1.0,3,3,9,Basketball
What can you do with small hands (6.0 inches)?," From palm to middle finger hand is 6.0 inches. I feel like it is affecting shooting and I really am not complaining when I say that. Like I know I'm skinny but you don't need to be buff and I'm having trouble because I can feel my right hand is not pushing the ball right. Also, shooting off the dribble is really hard to do for me, because I just can't grip it smoothly to shoot a jumper from the dribble. Its like I have to wait an awkward half second to grip the ball right then shoot.",1.0,3,3,1,Basketball
Why dont defenders angle their body more towards the offensive players off hand,"so if guarding Harden u turn/tilt a bit to the left

Most of the time its face to face",1.0,1,1,1,Basketball
Basketball tryouts,Is it possible for me to make my high school basketball team within 3 months of me practicing to the most of my ability ? (I’m a freshman btw) I don’t know anything about the game nor the fundamentals.,1.0,1,1,1,Basketball
How to choose a good AAU team?,I can see the team finder thing but how do I choose a good team? how do I know if their good and if their sponsored,1.0,1,1,0,Basketball
What headphones do you use while playing basketball?,"I’m looking for something that won’t fall out of my ears when i’m jumping around and playing close to game speed

Any recommendations?",0.6,1,1,4,Basketball
Dunking,"Hi, I'm an 18 year old who's trying to dunk for the first time. I have always been fairly athletic but nothing too jaw dropping. I played for the team in High school while also running cross country and track. I have always been able to touch backboard pretty easily and at this point I can slap backboard on a layup from a stand still. I've never trained explosively and have been more training long distance running. I could grab rim on a good day, anyways I'm just asking if there are any drills or workouts I can do to start getting into dunking? For reference, I'm around 5'10-5'11.",0.98,70,70,16,Basketball
Starting basketball after Age Of 20.,I couldn't play before due to my injury . But i wanna start now. Need some Beginners tips and exercises and all other gameplay . Really wanna start now. Thankx for all the help.,1.0,2,2,3,Basketball
Poem for the game I love,"A poem i composed about my love for Basketball.

I walk into the court full of lights,

The fans on their feet all buzzing with joy,

My family waving with smiles,

I'm glad they've seen who I've become.

The ball is passed to me &amp; i dribble onward,

A screen to the left &amp; I shoot,

A 3 pointer &amp; i'm now in the zone,

We jostle back &amp; forth with many points scored,

A bit of fouls &amp; timeouts used,

The game moves on.

I look around &amp; see my teammates  I've played with,

I'm glad they accepted me &amp; encouraged me to be better,

With endless days of sweating &amp; training,

we are proud of we've become &amp; now bonded by ball,

with trust &amp; love, we move on as family &amp; as one we ball.

Dunks &amp; shots fill the court,

layups &amp; 3's scores the point,

a pass to my mate &amp; the clock tic tocks,

with head up high the court is scanned,

I'm free, he passes &amp; this is it,

scared of ending the game is who i am,

With trust in his eyes I shoot the ball,

 A 3 point shot &amp; the game we win.

With smile &amp; joy we celebrate our win,

Now champions of the league i hang my shoe.

I open my eyes with a smile &amp; realize it's all dream,

In order to achieve my dreams I need to train some more,

Of to the court I run.",1.0,5,5,1,Basketball
im slow,"so I'm 15 5'9 and I'm pretty good at ball but I feel like my body reacts slowly to what I mean to do, like it's processing what I told it to do and my reaction time is also messed because of this and I have trouble catching bullet passes.

p.s i don't know if i should post it here but i dont know which subreddit to post it in",0.66,1,1,3,Basketball
Dunking,"I am at age of 18 and i have performed some exercises like jumping squats a year ago. I can hold the rim and touch it standing still but cannot dunk.
I want to dunk now. And i am 6ft tall.
What are the exercises shall i perform to learn clean double leg dunk?",1.0,2,2,0,Basketball
"I am a former High School All-State, College Division-I, &amp; European Professional Basketball Player. AMA.","The more time I spend on this sub the more I see younger players that have a lot of questions about making it to the next level. I thought it would be beneficial to share some experience with anyone who was interested. 

Some information about myself: 

In high school I was third team all state my junior year and first team all state my senior year. Senior year I also lead my state in scoring and was a McDonald's All-American nominee. 

I'm college I was a part of the team that ended with the most wins in school history. We were ranked top 10 in the nation, won our conference tournament and won our first round NCAA tournament game as a 5 seed. I had multiple individual accolades as well.

Professionaly I played for 3 years in 4 countries; Germany, Cyprus, Finland, and Australia. 

AMA.",0.99,143,143,139,Basketball
"I just got into playing basketball recently, would it be too late to get good enough to play on a team?","I’m 14, 5’11 and I just recently started playing casually, and honestly I’m trash rn but I still want to keep playing and try to get good, is it unrealistic to want to be able to make my schools team next year? Any tips to training? I’ve always loved watching basketball but I only started playing maybe a week ago, and I’m really bad, like I miss almost all of my shots, but I’m not too bad on defense",1.0,1,1,8,Basketball
Earbuds,I'm looking for a pair of fully wireless earbuds that won't fall out no matter what it's especially important that they won't hinder my shooting and I'll say this now no I'm not interested in airpods i hate everything associated with Apple,0.86,5,5,14,Basketball
Dunking while 5’9,Do you have to train differently when you’re “just” 5’9 or does height not really matter?,1.0,2,2,6,Basketball
Do I have any hope of being a semi-competent amateur player,"So I'm 29 years old and feel I might be in the bottom 5% of the world population in skill. Gym class still haunts me lol.

I recently got a basketball just to practice handles first(have no hoop yet) and it is SO difficult. I have watched some drills on YT but it feels like this is just something I can not get down. I feel so uncoordinated, I can barely dribble without looking at the ball!

I look at people dribbling between their legs while walking and they're gods compared to me. I'm not delusional, I'm not expecting to be some pro with my age/experience, I just want to be competent at handles and shooting....",1.0,1,1,3,Basketball
