title,selftext,upvote_ratio,ups,score,num_comments,subreddit
RULE REMINDER: You cannot Post Offers to Trade Or Sell Copyright Material. This includes Vertshock and Similar Programs,"Admins have banned other subs for this.

No asking for or posting codes for programs like Vert Shock

No asking for or posting illegal streams for games.

You will be banned, as I will not allow the entire sub to be closed for a few bad apples. This is your warning.",0.87,33,33,13,Basketball
"r/Basketball Weekly Discussion: Basketball Shoes - September 21, 2020","#Welcome to /r/Basketball's weekly Shoe Discussion thread!
   
##Got a question or need some buying advice?  
This weekly thread is for discussing the best shoes for YOU based on type of play, environment, price point, etc.

##Excited about that new Adidas or Nike line?  
This thread is also for getting hype for the next big sneaker.
   
*Moving forward, please post all individual shoe threads as a comment here, both for organization and record-keeping.*",1.0,2,2,0,Basketball
New Video: How Jimmy Butler Manages to be Both the Most Likeable and Unlikeable Player in the League,,0.97,107,107,11,Basketball
LIKE MIKE - COVErgeist ft BIG 6 - lyric video with MJ Highlights,,0.4,0,0,0,Basketball
Is it unusual that after i gained 50lbs in 5 months i somehow became more athletic,"The change in my athleticism has been insane, i can run faster,jump higher and just feel more comfortable in my body overall as i feel like i have better mobility and overall feel better at 230lbs than i did at 175. Before the weight gain i couldnt dunk despite standing at 6'5'' and couldnt even touch the rim (yeah it was that bad) but now i can do dunks that i thought were impossible before. I was also amongst the slowest players in the team and was mostly just another spot up shooter due to being incredibly slow but now i came in second at the 40yd dash at 4.46. So what im wondering is, did my weight really help with my athleticism or did i just grow into my body better over these 5 months?",0.97,98,98,63,Basketball
I am developing a pickup basketball game finder app and I am seeking any tips or ideas from the basketball community.,,1.0,8,8,9,Basketball
Hand Size,"I'm not sure if this is the right place to ask but playing ball is the only part of life where it affects me.

I'm around 6'1-6'2 and 155lbs 

I'm about to turn 16 and my hands are just crazy small; they measure 7 inches in lengths, 3.5 inches in breadth, and 8 inches in width.

I know this isn't the be-all and end-all but I'm genuinely curious as to why they're so disproportionate to the rest of my body. 

Thanks",1.0,5,5,8,Basketball
[HELP] College Hoopers Thread,,1.0,2,2,0,Basketball
Please help with the noise of my basketball practice,"I'm 16 (6ft) and have lost 20kg doing basketball drills and bodyweight plyometics in my back garden. (3 months now)

I usally do a set of plyometric workouts followed by a basketball drill (e.g: 15 jumping squats followed by, 25 left leg cross overs, 10 broadjumps, 25 right leg cross overs etc)

This week I have been working on pounding the ball on a very bouncy ball to help my handles.

I typically start my workouts at 4pm and finish at 7pm
Nothing after 7pm to be considerate.

My neighbor (neighbor X) confronted me about basketball in my backyard and how its disturbing him and his ill wife. And asked me to try play less, go to the park more or do it before 4pm.

I'm still terrible at basketball and unatheltic so reducing the hours of practice would be detrimental.

Going to the park is impossible on weekdays as it's a 2 hour trip, 30 mins to my closest but it's extremely dangerous and the rims have been removed since March.(the only one with rims is 2 hours away)

I get home at 3:30 so its impossible to play before 4pm and its even worse if I practice in the morning.

Legally I have a right to do what I want as long as it's not more than 3 hours, or between 9pm-9am.

What can I do to reduce the noise?
I was thinking of removing the grass in my backyard and build a basketball court. (As i only have a 2mx10m space to play. 6ft6x10ft)
Although regular tiles wouldn't solve the issue. I dont know about concrete. Perhaps a different material will be quieter.

I've been saving up for a backyard court for 6 months now and in another 6 I'll be able to afford it.

Untill then and after then what can I do to reduce the noise?

*sorry for bad formatting I'm on mobile*",1.0,3,3,19,Basketball
DOES ANYONE HAVE A A SPALDING 997 ABA RED/WHITE/BLUE BASKETBALL??? LEMME KNOW!,,0.95,147,147,9,Basketball
Tips and drills,I am having tryouts for basketball in a week. Plz share some drills and tips to help my game get better.,1.0,1,1,7,Basketball
I keep bruising my big toe nail; question about shoe size,"I’ve started a basketball league after playing a few months of pick up. My right big toe is severely bruised and painful from hitting the front of my shoes. Everything online says I need tighter shoes to slide less but my right foot is actually half a size bigger than my left so I feel like it may need to be larger? Unless the effect is due to my right foot being dominate?

Anyways, how tight should basketball shoes be at the toe?",1.0,2,2,3,Basketball
"Why do NBA players get and 1 when they make a shot only after getting fouled, landing, and jumping again?",,0.98,54,54,10,Basketball
So I just started like officially liking basketball :D,"Ok so I know what you're thinking.

""You're just now...in 2020...liking basketball....bruh."" 

So basically like when the NBA was coming back to resume the league, I was curious.  My main question as a fan of a lot of other sports was: ""hmmm...wonder how the pause in the season is going to effect how they do shit"" and WOW. seeing so many of teams top stars doing so well after a good rest was really cool to see and so I went from just enjoying playoff deciders to thinking...""maybe I should start rooting for a team"" 🤷‍♂️ 

(I also discovered Secret Base, previously known as SBNation on YouTube and fell in love with their content) 

To give some more context I was born and raised about an hour from Oakland/SF and obviously have noticed the YEARS of the GS Warriors doing incredibly well, even before I started actually watching full games this year I would peek in every now and then and watch the Warriors do some pretty incredible stuff, (as well as just be aware of other notable players on other teams) HOWEVER I DO NOT feel sincere rooting for them. To just go from not really enjoying the sport to just start rooting for the team that is coming off one of the most impressive teams in sports history and is arguably just going to go right back to its winning ways I can't consciously implode the bandwagon.

To go back to what I was saying earlier I got into the sport definitively through the playoff deciders so yeah I was gonna technically be bandwagoning no matter who I ended up rooting for. BUT after carefully accessing how I was gonna pick the team I decided to do it the way I initially picked my favorite soccer team, I looked at who my favorite player was playing for...so for this it came down to 2 guys for me with my limited knowledge:

Russell Westbrook

And Jimmy Butler.

The decider to that came down to the sole fact that I will not root for a texas team.

So after binging secret base videos, doing some research on the organization as well as watching the team get a 2nd victory over the pacers in the playoffs, I became a Miami Heat Fan. 

Thanks for coming to my TedXTalk",1.0,3,3,1,Basketball
How do I make the NBA,"I’ve really only been interested in one thing. Basketball. Basketball has been my life and my best friend for ever. I want to pursue it and make it to the top. I’m willing to do anything. I’m 6 ft (probably will get 6’3” MAX, so point guard workouts) 9th grade. I’m asking what I need to do and how I need to do it to make it. What drills I need to do, what workouts I need to do, what exercises, what mentality exercises. I’m willing to do anything. I’m willing to go through hell and back. Anything will be appreciated. Thanks.",1.0,2,2,6,Basketball
What I wouldn’t give to play inside.,"So I’m pretty good about social distancing. I play 2v2 with my friends and they’re all I see outside my gf.  But I live in Seattle, and the dark times are coming soon. Playing ball outside is already costing me a lot in shoes, and soon that will even be a scarce option. 
Anyone able to play inside? All inside courts are banned in WA. Even at LA fitness I can’t reserve a court to practice by myself, which I think is pretty lame.",1.0,2,2,8,Basketball
Michael Jordan having ADHD - real or fake?,I’ve seen several articles claiming Michael Jordan of having ADHD. Where does this come from and is it true?,1.0,2,2,2,Basketball
"I just finished the last dance and I'm new to liking basketball, is there any documentaries just as good?",,1.0,1,1,5,Basketball
Smart watch for basketball,"Hi, what’s a good smart watch to track my basketball activity?",1.0,1,1,4,Basketball
Do I have any chance? Should I play hs ball?,"So for context, I'm a 15 yo HS sophomore, 6' 3"" and 135 lbs. I have a bit of a history of not being great at basketball, but I've played for a long time. I just recently started getting back into it and was thinking of trying out for my hs team. Will I get annihilated by the kids who've been playing since they were kids?",1.0,1,1,5,Basketball
"Hyper extended elbow, anyone who suffered the same?","My elbow hyper extended a lil fighting for a loose ball last week, I can shoot and all nicely except for threes from too far. Should I keep going to the court and improve my weak hand or so? Or should I strictly rest so it fully heals? I don't think I'll resist the temptation of shooting lol",1.0,1,1,1,Basketball
"I'm planning on trying out for u15 rep, any tips?",Any advice appreciated honestly.,1.0,1,1,1,Basketball
Where should I start?,I want to pick up the game and be able to join my school team sometime but I never played basketball and I’m kinda bad. What should I do to start out? I’m a freshman.,1.0,1,1,1,Basketball
Getting back into basketball,"How to get back into basketball before I started high school I used to be a good shooter and crazy on defense in recreational games but when high school started I went into track and cross country because I was never good in a 5v5 I am more of a 1v1 kind of guy, now I want to get back into it after getting inspired by watching nba and Haikyuu. Does anyone have any tips to get back into it.",1.0,84,84,14,Basketball
Who do you think my team MVP should be based on the stats below...,"I'm a player/coach for a local mens' league where I live. Our season is over and thought it would be interesting to see what some thoughts were on who you would pick for MVP based on the season stats, which are below. Thanks in advance and looking forward to seeing your pick. 

Player Number 4: **Games**: 6, **Fouls**: 12, **DReb**: 5, **OReb**:2, **TO**: 11, **Steals:** 13, **Blocks:** 0, **Assists**: 14, **2FG** 5-11, **2FG%**: 45%, **3FG** 5-20, **3FG%**: 25%, **FT** 2-5, **FT%**: 45%, **Tot Points**: 27

Number 6- **Games**: 8, **Fouls**: 11, **DReb**: 11, **OReb**: 8, **TO**: 14, **Steals:** 13, **Blocks:** 1, **Assists**: 17, **2FG** 17-47, **2FG%**: 36%, **3FG** 0-4, **3FG%**: 0%, **FT** 6-10, **FT%**: 60%, **Tot Points**: 40

Number 7- **Games**: 8, **Fouls**: 3, **DReb**: 22, **OReb**: 4, **TO**: 8, **Steals:** 16, **Blocks:** 0, **Assists**: 10, **2FG** 32-69, **2FG%**: 46%, **3FG** 6-54, **3FG%**: 11%, **FT** 6-14, **FT%**: 43% **Tot Points**: 88

Number 8- **Games**: 6, **Fouls**: 3, **DReb**: 3, **OReb**: 8, **TO**: 2, **Steals:** 9, **Blocks:** 1, **Assists**: 6, **2FG** 9-20, **2FG%**: 45%, **3FG** 0-0, **3FG%**: 0%, **FT** 1-5, **FT%**: 20% **Tot Points**: 19

Number 9- **Games**: 8, **Fouls**: 12, **DReb**: 24, **OReb**: 10, **TO**: 16, **Steals:** 7, **Blocks:** 1, **Assists**: 2, **2FG** 21-53, **2FG%**: 40%, **3FG** 1-4, **3FG%**: 25%, **FT** 10-16, **FT%**: 63% **Tot Points**: 55

Number 10- **Games**: 8, **Fouls**: 10, **DReb**: 35, **OReb**: 12, **TO**: 12, **Steals:** 3, **Blocks:** 3, **Assists**: 7, **2FG** 14-40, **2FG%**: 35%, **3FG** 0-0, **3FG%**: 0%, **FT** 2-10, **FT%**: 20% **Tot Points**: 30

Number 11- **Games**: 7, **Fouls**: 7, **DReb**: 19, **OReb**: 4, **TO**: 3, **Steals:** 3, **Blocks:** 2, **Assists**: 12, **2FG** 5-13, **2FG%**: 38%, **3FG** 0-0, **3FG%**: 0%, **FT** 8-10, **FT%**: 80% **Tot Points**: 18

Number 12- **Games**: 7, **Fouls**: 7, **DReb**: 14, **OReb**: 15, **TO**: 18, **Steals:** 5, **Blocks:** 1, **Assists**: 18, **2FG** 19-41, **2FG%**: 46%, **3FG** 0-2, **3FG%**: 0%, **FT** 7-18, **FT%**: 39% **Tot Points**: 45

Number 13- **Games**: 8, **Fouls**: 9, **DReb**: 46, **OReb**: 30, **TO**: 0, **Steals:** 14, **Blocks:** 8, **Assists**: 16, **2FG** 14-42, **2FG%**: 3%, **3FG** 1-6, **3FG%**: 17%, **FT** 15-29, **FT%**: 52% **Tot Points**: 46",1.0,2,2,4,Basketball
Dunk practice,"Looking for advice,
I try and dunk about 25 times everyday on a 9’6 basketball and I’m going to try and move it up every so often. Is this smart or should I have a rest day between?",1.0,2,2,3,Basketball
Height,"So currently I'm 14 (about to turn 15 on september 21st) and I'm 5'10/5'11, I am really hoping for a crazy growth spurt. If I don't have that crazy growth spurt, how tall will I grow on average? My mom is around 5'4/5'5 and my dad around 5'7/5'8. I don't know any other relatives.",1.0,3,3,5,Basketball
How much should I practice?,Hey everybody. I’m wanting to make the nba one day. I was just wondering how much should I train everyday. I am 12 going on 13 in one month and I’m wondering how much I should practice. Right now I do 3 hours of drills and 1 hour of workouts. And also how much sleep should I get? Thanks a lot.,1.0,1,1,7,Basketball
"This is my vertical workout I was wondering if I needed to add something else, (gyms are still closed).","- Jump rope 2 sets of(5mn)                                 
- squad jump 3 sets of (12) 
- lunges 4 sets of (30)
-  calf raises 2 sets of (95)
- Single leg squat 4 sets of (20)
- Lateral jump 4 sets of (15)",1.0,1,1,12,Basketball
Weak hand driving advice,"I can't drive with my right, I'm a lefty probably just because of the comfort it naturally gave me. I had hip surgery when I was 4 years old and right hip flexibility is evidently worse, plus I broke my right hand 3 years ago and even tho it healed nice it aint the same. When I try to drive right handed I feel like I can't put my right hip above, in general the right side of my body, I just practice and practice but i can't coordinate. Should I go see a physio/doctor seeking advice so it can improve? Or should I just get OP with my left? If someone have dealt with sum like this your advice will help a lot 😁",1.0,1,1,0,Basketball
How Do Pro Basketball Players Train,"Drop any knowledge you know about players training. Also any video or article on this topic
I’ll start, most players work on one move all offseason",1.0,8,8,4,Basketball
confidence,what can i do to get more confident,0.8,3,3,4,Basketball
Quick question idk where to ask lol but I’m buying my first jersey what’s the difference betweeen xxl and 2x?,,0.67,1,1,0,Basketball
Question about tryouts,"I played good at tryouts and at the end of tryouts the head coach asked me what my first and last was, does this mean anything?",1.0,1,1,9,Basketball
Is this really special?,"I have a WNBA basketball signed by Kobe Bryant. I have the COA.

I got to work with him and had several items signed over the years. I haven't been able to find another WNBA sized basketball signed by Kobe anywhere and I was wonderin if that was because I am new here or because that is actually rare.

Thank you for your insight!",1.0,4,4,1,Basketball
High school advice,"I wanna try out for my high school basketball team. I just wanna know some tips or things to know before i do so. I've never been in a basketball team and I barely started getting into basketball. I really dont want to embarass myself, so please help. Any tips or things to know will be accepted.",1.0,3,3,2,Basketball
To all people who go to the basketball court without a ball....,Please get a ball and stop harassing people who are trying to get a good practice in to use their ball. Its annoying. Why even go to the court without a ball? It's like going to school without a pencil and going to the store with no money.,0.85,8,8,4,Basketball
"Does the rim height, court size etc. Matter?","When im not playing organized basketball i practice alot on a local court, the rims are a bit lower though and it is a bit smaller, does this impact my training  does practicing on it not make a difference from practicing on a real full size court?",1.0,1,1,2,Basketball
Bodyweight Workout completely no equipment,What's a good bodyweight workout with no equipment at all for a 14 year old tryna get stronger.,1.0,2,2,4,Basketball
How to increase your vertical (The way I did),"Before i start just wanted to give a little background info on me. I'm 18, 6 3"" 180lbs with a very average reach. I've always played varsity hoops through High School but never had the athleticism to get to the next level. I touched the rim for the first time at 14 when i was 5 10.  I got my first real dunk without dribbling at 16 when i was 6 2"". I've been able to do pretty lame dunks since then but when the pandemic started and with so much free time i decided to try and really increase my vert. Now in the past i tried 2 or 3 times legitimately to increase my vert with 0 results. I am going to tell you my tips and tricks that took me from barely grazing the rim, to tomahawking and reversing.

* 1: You can't just do a million calf raises

I watched every single video on youtube on **""how to increase your vert by 9 inches in 3 minutes""** Now some of these vids have decent advice, gimicky stuff won't work. Trust me, I've tried.

*  2: You have to fully commit to working out your entire body

The few times in the past i tried to increase my vert i worked out exclusively my legs with little other full body work. Now I know this may make me not sound credible anymore but i was young and naive when i tried that approach. To fully increase vertical, set a workout plan and hit the weights. There inst a full body workout that won't help your overall fitness, which translates to your jumping ability.

* 3: Learn the proper form

If you aren't naturally a good jumper, form is essential. I increased my own vert by at least 4 or 5 inches by just getting perfect form. To do this either watch tutorials, (THINCPRO Basketballs videos helped me a lot) or watch nba players or pro dunkers and try and emulate their approach. Getting good form is awkward and time consuming, but also the easiest way to increase your vert.

* 4: Start Low with a small ball

Now not everyone has access to a low rim, but try and find one if you can. Its the best way to practice form and footwork. If you don't have an adjustable rim, find a school or park with a smaller net and work there. I still always warm up on a low rim. Don't start with a 29.5 sized ball either. Work your way up from a golf ball to an nba ball

* 5: Dunk every day

This tip may sound stupid, but it is what brought me from barely dunking, to yamming over guys. Over the past 6 months i dunk for about 45 minutes to an hour straight every day. Low rim, high rim, doesn't matter, like any athletic ability, repetition is key to sucess!

These 5 super simple steps take a lot of hard work, but helped increase my vertical over 8 inches. If you want any personal advice please private message me and ill give you whatever knowledge i have!",1.0,3,3,4,Basketball
Best coaching tools on the internet?,"Things like analytics, plays, scheme philosophy, etc etc. looking to improve my 1-3-1 motion I run.",1.0,1,1,0,Basketball
Tips on how to get my first dunk,"Recently i have been able to start touching the rim prety consistently,to where i can almost get my entire fingers over the rim.Im only 14 and already 6'2 so ill be growing a lot taller than this and in the future im confident ill be able to dunk.But for now i want some tips to help me get there a bit easier,maybe some jumping  techniques or how to hold the ball properly when i jump.I will be working hard this season so my vertical will defenetly increase in the next few months.For now i want to know how i can get there quicker",1.0,2,2,2,Basketball
I want to make it to NBA level,"I practice 3 days a week organized basketball around 1 hour and 30 mins with other people, and then practice by myself around 2 hours. On non traning days im gonna practice by myself 5 hours. Will i improve alot even though i practice all by myself and only play pick up few times with a friend on the non training days? Will this 5 hours a day alone still make me reach a much higher level? Or do i need to play with other people those days too?",0.92,50,50,47,Basketball
Pain in Training,"Just a friendly reminder, please don't train through pain!",1.0,1,1,0,Basketball
How Do Professional Basketball Players Train,I’m tryna learn how the best do it. Drop video links articles etc on how the best train. N I really just mean the guards.,1.0,1,1,0,Basketball
Looking for some critique on my shooting form - thoughts?,,0.99,84,84,54,Basketball
Dunk-friendly basketball rims for public courts?,"Our neighborhood basketball court has anti-vandal rings that are quite sturdy, but really don't facilitate dunking. The ring isn't really a ring but more of a cilinder that isn't as thick as a regular ring.

I'm wondering if anyone knows of a type or brand of basketball ring that can be used in a public (outdoors) setting but still allows some dunking.",1.0,1,1,0,Basketball
Why is Michael Jordan so great?,I don’t know much about basketball. I can enjoy watching a few ballgames and really enjoyed the Raptors Final a year or two ago. The most I know about MJ is from Space Jam because I’ve seen it maybe 20 times. Why is he so good? I’ll take a long or abridged version. Thanks!,1.0,2,2,5,Basketball
"What exactly is a ""double clutch""? What is the difference to a ""up and under""?",,1.0,1,1,1,Basketball
How much can a beginner expect to improve their standing vertical jump?," I am not sure if this is the right sub to ask this, but I would like to know how much a complete beginner can expect to improve their standing vertical leap. As someone who has never trained legs, who has always skipped leg day, has never played basketball or any sport related jumping, so a 100% baseline newbie at jumping for all intents and purposes...

I am asking this because I would like to comfortably perform a standing vertical dunk. Recently measured my standing vertical at the local gym's vertec, and I estimate I am probably 5 to 6 inches away from this goal. Was wondering if I can expect such an improvement if I started leg day + jump training and whatever else it's going to take.",1.0,8,8,2,Basketball
Is a 31 inch max vert good for not doing weights or very training?,"5’11, 135 and I hoop every day n just jump a lot, I haven’t really used weights could I get around a 40 inch if I trained hard and used weights?",1.0,1,1,0,Basketball
Should I play ball during the pandemic?,"I'm planning weather I should play with my friends in the local court, but my friends from my other school are coming and bringing their friends over. So altogether a total of 13-15 people. I live in an area where the first case of Corona had came up and, in the last , 8 cases have appeared of people testing positive. My friends don't really care because we're only 15 and all but should I go or just train by myself.",1.0,3,3,2,Basketball
improving my jump," 

hi i am thinking of starting vertshock,i have heard it works for some people and not for some, I did weighted squats and lunges some time ago, i think my legs are strong. I can touch the rim with a standing jump(I am 5'9) but there is almost no difference in my running jump, its almost the same. and my one foot jump is much more bad than my standing two foot jump.

do you think vertshock will help me? if not what will?",1.0,2,2,2,Basketball
Basketball would be better if each game was the best of 5 periods,I feel like the best basketball games always come down to the last few  minutes of the last quarter. It would be more fun to watch if the end of  each period had that kind of excitement.,0.83,4,4,2,Basketball
i got the heat or lakers,"who y’all think is winning it all this year?

[View Poll](https://www.reddit.com/poll/iv52ec)",1.0,1,1,0,Basketball
Frustrated about Shooting,"I'm frustrated in shooting man like I've been researching how to shoot like Carmelo Anthony for two days straight analyzing what he does, but whenever I try to do it, my form is garbage. I'm a beginner and I wanna have a good shooting form cause I want to be a great shooter. For me, I want to be a reliable guy on the team, but it's hard to not quit when I am the only person assessing myself and I can't even get a coach. I've been putting a rubber band on my middle finger so that my release point can be on there, but my wrist always flicks to the right. I also been practicing my shooting form in front of the mirror without the ball and I video record myself as well. I bought the Steph Curry's masterclass so that may help anyone got any tips? Just feels like I'm complaining and not working hard and efficiently enough.",1.0,2,2,6,Basketball
