title,selftext,upvote_ratio,ups,score,num_comments,subreddit
Lebron seriously needs midrange game,"watching tonight's game,

i realized the fact that lebron just can't be 'clutched'

It's true that his athletism and passing skills and court visions are one of the greatest in nba history

But he needs to be able to score from any spot on the field to carry the team and win the game

Tonight lebron was great, but he wasn't able to win the game,cuz he just can't shoot 

Lillard? He scored 4 deep threes in  6 mins remaining in 4th qtr
Anthony? He didn't do very good today, but still he made a three pointer that concluded the game

If lebron doesn't improve his shooting skills, he will never be on the same page with Michael Jordan 
Not even magic johnson or kareem 

Who won 5 or more titles in nba

Lebron needs to be able to shoot from midrange and score without anyone's help  
if he wants to win more titles and be certain no.2 in nba history",0.4,0,0,7,Basketball
"I need help with shooting, I keep trying to shoot consistently but it ain’t working.","Sometimes I feel like I can’t miss, some other times I can’t shoot for my life, is it something to do with my form?",1.0,1,1,1,Basketball
Laker v.s. Blazers,Who do you think is gonna win after the Blazers win over the Lakers by 7? Damn Dame time is in hot... sjdskjdksj,0.99,1,1,3,Basketball
Dutch basketball league,What is the average salary of a professional basketball player in the Netherlands?,1.0,3,3,1,Basketball
How to get fast like DeAaron Fox,,0.5,0,0,1,Basketball
How much does the wind affect the ball outside?!?!?,Am I crazy or is it a significant change in projection sometimes?!,0.75,2,2,4,Basketball
How do i make a Shoe Circuit team,I’ve never played aau or anything but i was just wondering how do i make a circuit team. Is there tryouts or how does it work?,1.0,3,3,10,Basketball
What do coaches look for,"So I’m a 12 year old 5’7 130 pound kid who is going into high school next year and want to try out for high school team, I have played driveway basketball for about 4 years and just started taking it seriously this year, I’ve raised the net to 10 feet and am playing on that for a bit, I’m mainly focused on dribbling and shooting, considering I can’t really jump as high as everyone else, but I have a few moves I use close to the rim, my strengths are, well strength, hand eye coordination, dribbling, shooting and confidence, I have never actually played a real organized game unless I’m counting some when I was 7, I can’t find anyone to play because I live in a hockey town up north, I really want to make it, and have dreams of nba or at least g-league, I am willing to be in the gym for hours and am open to suggestions about what coaches look for, thank you!",0.75,2,2,6,Basketball
"Is it too late for me to start playing Basketball in college? , I'm 16 and 6'3 , but i already have a basic understanding of the game , Answers much appreciated",,1.0,102,102,61,Basketball
Tips for raising the net?,"So I have posted a few things about what to do to get better, almost everyone says to raise the net to 10 ft (I play on 8) and I think I’ll try it, I have been slowly raising the net from 8ft to 9 and just hit 9 yesterday, i want to go straight to 10, but I always fear it going into the streets or bouncing too far away and me having to go back and forth to get it which will get annoying, but I think I’ll try it, so my question is what should I be focusing on when I raise the net, layups? Midrange? I have a high arc so I can shoot pretty well on it, I’d say around 45% on a 9 ft. Thanks in advance!


And before I have to comment all this stuff here are my height, weight etc...

12
5’7
130 lbs
23 cm hands
Standing reach of 6’2
Each my arms are around half a meter long 
Strong 
 18 inch Vert :/ ( had to remeasure)
Shifty
Kinda fast",1.0,1,1,3,Basketball
Choose one 🏀,"

[View Poll](https://www.reddit.com/poll/ic57i0)",1.0,1,1,0,Basketball
Who's the Goat ?,"

[View Poll](https://www.reddit.com/poll/ic55bk)",0.4,0,0,8,Basketball
Nervousness and Anxiety,"I’m 20 years old and I technically only started playing Basketball for 3 years. Up until recently I would ONLY do drill work and would be to nervous to play in actual games whether it be 5 on 5, 3 on 3, 2 on 2, etc. Right now I play as many games as I can. My main issues are my physique (People blow by me easily when I play defense) and I am to scared to make moves, attack the basket, and to cut. My main goal is to try out for my college team next year by working on my physique and playing more games this year and eventually play overseas. As I play more, will I overcome my anxiety?",0.9,13,13,27,Basketball
I am addicted to Basketball help me I am trying to take a break from the game. Should I?,"So basically I am a college student who on their free time I just play pickup for hours thats all I look forward to tbh. My friends mostly are all made from the basketball court. The thing is im addicted to ball runs without it I feel somethings missing. At the same time its not helping me with my discipline to hit the gym I am 120lbs 6""0 early 20s basketball player I get posted up alot. I want to take a break from ball for like 6months or till end of 2020. What should I do? I also want to be disiplined in other aspects of life like gaining muscle. I am pretty damn good at ball a guy who is 165lbs usally wont post me up but I struggle against the 175+ weight range to guard. If I stopped playing and gained weight will that make me better assuming I get back to my ball routine like now in months from now.",1.0,12,12,6,Basketball
Buying a ball and need advice/recs,"Tryna get a ball that is a good balance between cheap and good quality. Price range is &lt;$30 (hoping for $20 tho lol) but I might stretch to 35 if its really worth.

Looking for a nba sized ball (29.5 in) that has a decent grip, can last for a long time with assumption in doing my part to take decent care of the ball, and will primarily be used on an indoor court (might be used a tad on outdoor courts but rarely and not hard use (shoot around)).

I’m looking on sites and there’s so many different basketballs I don’t know what’s good and I’ve only ever owned one meh ball for myself so any help or advice in deciding is appreciated.",1.0,9,9,11,Basketball
What’s more important,"

[View Poll](https://www.reddit.com/poll/ibsyrk)",0.88,6,6,7,Basketball
Anyone from Kashmir ??,,1.0,5,5,1,Basketball
{Help #1},"I am trying to get offers, particularly D1 offers. I am a 5’9 PG, going into my junior year. What are some physical skills and intangibles that’ll help me get high major offers? 

I need help choosing the right high school for hooping.
What are some things to look for when choosing the right high school to get offers? Private? Public?",1.0,3,3,2,Basketball
Basketball back pain injury,"  

I am a former semi-professional basketball player. I haven't been playing pro for a while now. However, I hurt my back while training. That said, even back in my playing days, I had back issues. 

However, this time it was the worse thing I ever experienced. The compound effect of continuing to work out and play sports at a high level eventually took its toll.

I lost all control of my right leg as it was dead due to nerve damage, and I had severe pain in my lower back. I was meditating daily, sleeping on the ground in specific positions to relieve pain. 

I went and got an MRI, and I found out that I have an L4, L5, and S1 disc herniation (bulge). 

After hearing this news, I knew I couldn't ignore it any longer. I knew that I had to figure out what I could do to make it so that I'd never go in an MRI machine for my back again.

I have a lot of negative emotions connected to my back injury. I was disabled, I had low confidence, I wasn't able to do simple things for family, friends and loved ones. I felt useless, and my self-worth was at an all-time low, and I felt utterly alone. 

I was searching high and low for a solution. Every day, I would scour the internet for anything. Someone to tell me, it was going to be okay, that if I just did X, Y and then Z, I would be healed. 

The good news is I ended up finding him, not online, but within. 

I realized that no one was going to come and help me. I had to take it upon myself, do the research, see what worked and what didn't work and bring it all together for a comprehensive plan for my daily life. This was not a one-time solution, but rather a change in lifestyle. 

Well, I am here today to tell you, the person reading this, that I did it. I was able to find the solution for me, and you can as well. 

I am writing this to let you know that you're not alone. I am here, and I want to help. 

I've just decided to help people. Because we all know that until you have a back injury, you just don't understand. 

**Tell me your story, tell me how you feel, talk about your pain, your life, how you manage day today. Ask me questions about anything! I'm here…** 

I'll end with this…

My back injury taught me that no matter how bad an outcome maybe, I can always learn from it and come out on the other side with a different skill, perspective, or ideology. It taught me that things are ever-changing, and it is essential to go with the flow, accept your situation, and figure out how and what you can learn from it. I believe the quote from Bruce Lee encapsulates best what I mean, when he said, ""be like water.""",0.78,5,5,3,Basketball
Is it too late for me to start playing basketball at 14?,"im 14 and 5 foot 10 and play with my friends sometimes, i know the basic stuff like the rules, i think i have a pretty okay shooting form and i can dribble between my legs but pretty inconsistently. Will everyone else im playing with and against be miles better?",0.67,1,1,6,Basketball
Vertical jump training improvement,"Hello guys I am 15 years old and have roughly played basketball for 7 years. Recently i started going to the gym. Can you suggest any improvement i can implement in my training for vertical jump. I do 3x10 squats, 3x10 leg press, 2 or 3x10 leg extensions and 2x10 leg curls. After every set of 10 i do 10-15 box jumps. So as i said can you guys help me out with making my program better I would be very thankful!",0.86,5,5,5,Basketball
It is a offensive foul?,I was playing  full court pickup ball yesterday and there was a play where the guy defending me got hit in the chin and was on the ground in pain. My question is it a foul on the defender and an offensive foul? The defender who got hit was complaining it was a offensive foul and a couple people including myself said it was actually a foul on him. The play was me catching the ball inside underneath the rim then the defender got up behind me with his arm over my head along with his chin. I went up strong and my head his is chin coming up to shoot a layup. Is this a foul on me or the defender?,0.86,5,5,9,Basketball
Does anyone else love the game of basketball but doesn’t like to watch the NBA much at all?,"I feel like this is weird, I can only watch big games like the finals or maybe a few playoff games but I find watching NBA games really boring. I love basketball so much and play everyday",0.94,115,115,34,Basketball
Looking for a dribbling instructional from back in the day where the guy sounds like he’s grunting hilariously as he dribbled,Anyone have this video?,1.0,1,1,0,Basketball
Is it possible to make your colleges club team if you couldn’t make your high school team?,To be fair my high school is extremely competitive,1.0,2,2,15,Basketball
Can someone who played club basketball (not varsity) in college dm me?,I got some questions,1.0,1,1,1,Basketball
"r/Basketball Weekly Discussion: Basketball Shoes - August 17, 2020","#Welcome to /r/Basketball's weekly Shoe Discussion thread!
   
##Got a question or need some buying advice?  
This weekly thread is for discussing the best shoes for YOU based on type of play, environment, price point, etc.

##Excited about that new Adidas or Nike line?  
This thread is also for getting hype for the next big sneaker.
   
*Moving forward, please post all individual shoe threads as a comment here, both for organization and record-keeping.*",0.76,2,2,16,Basketball
"NEED HELP, HOW DO YOU CATCH A BALL IN FASTBREAK SOMETIMES I SLOW DOWN SOMETIMES I RUN TOO FAST , HOW DO YOU KNOW THE BALL IS COMING AND NOT GET HIT",Sounds dumb HAHAHAHAHA,0.6,1,1,5,Basketball
We adapted a new rule at the court I play at.,"Instead of the classic old ""shoot for it"" or ""ball don't lie"" rule, we adapted a rule where if there is an argument or controversy,  each team takes turns getting the ball. If team x got the ball first, upon the first argument, team y would get it. What do you all think about this rule. Should it be adapted at all courts. I always absolutely hated the shoot for it rule. The BALL DOES LIE. And the rule is heavily favored for people that are good at shooting 3s. Often I see this rule abused. A good three point shooter will just start an argument about a call, then he'll shoot for it and likely make it. It's a win-win situation.  It just doesn't make sense how this street rule got started.",0.86,5,5,2,Basketball
Vertical jump training improvement,"Hello guys I am 15 years old and have roughly played basketball for 7 years. Recently i started going to the gym. Can you suggest any improvement i can implement in my training for vertical jump. I do 3x10 squats, 3x10 leg press, 2 or 3x10 leg extensions and 2x10 leg curls. After every set of 10 i do 10-15 box jumps. So as I said can you guys help me out with making my program better, I would be very thankful!",0.76,2,2,3,Basketball
Playing competitive basketball as a newbie,"Hey guys, just wanted some tips from you. 

I’m joining a basketball league in October after getting interested in the sport over lockdown. I’ve been playing a fair bit at an outdoor court just learning how to shoot, practicing layups and dribbling etc. Also played a 1v1s, 2v2s and some 4v4 full court (way smaller than a normal basketball court though). 

Any advice for when i start playing competitively in the league? Anything that could prepare me for that, anything you think I should know etc etc.

6ft2 and 190lbs 

Much appreciate guys!",0.98,65,65,19,Basketball
Best shot creator at the point guard position ever?,,0.88,6,6,6,Basketball
Question about the 2 steps you are allowed to take after end of drible.,"Does the rule say you have the 2 steps have to be in a forward direction? Can you drive in, take 1 step in, then 1 big step back for a sort of fade away shot. I been doing this move recently, and no one called a travel, but for some reason I feel like its a fishy move.

Also, does the rule specify how much time you have to take the two steps. I always wondered this. Obviously you can't take 1 step, wait 20 seconds, then take the second step. I know it has to be in motion, but any specific rule about how fast/slow the motion has to be, or how much time you have between steps?",0.5,0,0,1,Basketball
Nba league pass vs premium,"I'm the only one in my family that watches cable TV, and that too only for basketball. I'm looking at league pass. I was wondering it has all live games for all teams and what the difference between that and premium is. For those that got it, is it worth?",1.0,2,2,1,Basketball
"I’m 5’8.8 (175cm) and 14, can play from close to medium range, and am rather skinny, what position should I play?","I’ve been playing for 2 years, still haven’t figured out what to play as. Mediocre handles, accurate passing, can jump ok high",1.0,1,1,5,Basketball
NBA Finals Game 7: Coach puts his bench in after being down 30. Crazy comeback: It's tied with 3 minutes left. Should he sub his stars back in?,"What would you do? Keep your ridiculously hot bench in or play the proven stars?

Has something like this ever happened?",0.92,10,10,5,Basketball
I need help with my shot,"I got new shoes and they are really comfortable (new Giannis shoes) but since I usually play with not high shoes, this has affected my jumpshot dramatically. Anyone know how to fix your jumpshot?",0.67,1,1,0,Basketball
"Basketball players: stop snacking and drinking soda all the damn time, there’s a reason your not in good shape.",Paul George himself said snacking made his game lack tremendously,0.4,0,0,6,Basketball
"What does it mean when they say a team is good at playing ""small ball?""",,0.97,84,84,22,Basketball
Smaller basketball players have any advantage?,Why so much of the best nba players are small? Why players like Tacko Fall can't get minutes while a guy like Muggsy Bogues played in the NBA for more than 10 years? Why the Rockets small ball is working? Does being a small basketball player comes with some advantage?,0.67,1,1,5,Basketball
"I have so many D1 schools interested in me and contacting me, but none of them have offered",Do you think they are maybe waiting for one school to do it first?,0.6,1,1,3,Basketball
Basketball Drills,"Hey guys! Although basketball season is till a bit away for me, and I don’t even know if my state will let us play, I want to know some drills I should do so I can start improving more so I can really show up at tryouts.
FYI: I will be in 8th grade c I’m 5’9 (feet,inches), and 170 lbs and I usually play at PF. I want to improve most down in the paint, in specific I want to improve my rebounding/boxing out and I also want to be better at post moves and instinct (Knowing what to do in post situations), and I could also improve my quickness. The problem is, I dont know any drills to help me. I have a hoop on my house that I can practice on, but I dont have a full court. Any drills you guys know to help me improve my skills would be great, although I want to get better in the sections I already stated, I also just wanna improve as a player. Any suggestions are much appreciated!",1.0,1,1,3,Basketball
Lack of Experience,"I'm 16 years old and have only been practicing for 4 months, but I'd say my abilities are more of someone who's been practicing for around a year. I'm 5'9, fast, shoot around 50% from midrange, pretty good handles but an inconsistent layup. I want to join a league pretty soon, but I feel that my lack of experience might really show. What can I do in a relatively short span of time to gain the most experience I can?",0.67,1,1,2,Basketball
Help with my game,Hello. I'm 14y.o. and 6'2 and play a stretch 4 or a center. The system in our competition is kinda screwed and even tho me and the whole team is about 15y.o. and we play against guys that are 19 so I'm pretty undersized for my position with this competition. I'm heavy so i can post up well and I'm good with hooks. I'm a great defender. I have a decent mid range game but no real 3ball. Good FTs and hard screens. I can also pass pretty well. Could you please help and tell me what I should work on and focus on. Thanks.,1.0,1,1,1,Basketball
Watch My highlights,,0.92,60,60,24,Basketball
How do I perform in my league,There’s this league going on this Friday and the best hoopers get invited to an elite league for the best players in the country and I know that I can perform to at least get a few buckets up since there are players on my level getting crazy buckets but I have no confidence. I know I probably won’t make it to the elite league this Friday but I at least wanna get a few steps closer to getting there because right now I have 0 confidence and only take stupid shots and that’s only 1 or 2 shots a game maybe even 0. Any tips on scoring when I have 0 confidence?,1.0,1,1,4,Basketball
How to be more pro in basketball guys?,How can i improve? Can you teach me some advanced tips? Please hehe.,0.25,0,0,1,Basketball
What makes a good defender?,"Tryna be a good defender, so what does it make one",0.67,1,1,2,Basketball
"My friends doesn't want me to join their basketball game because i'm weak, what should I do to improve my skills?",They keep doing the same thing for over a year now and I'm depressed,0.67,1,1,3,Basketball
Who are some players that everybody loves?,,1.0,1,1,7,Basketball
Who will win the championship ?,"

[View Poll](https://www.reddit.com/poll/iams5r)",1.0,2,2,0,Basketball
Where should I start if I want to increase my vertical jump?,"I have been working on my finishing a lot and I'm planning to start working on my vertical. But the thing is, is that I don't know where to start. I've heard about jumping techniques, landings, and some drills, so any suggestions on where to start? Any youtube videos or guides I guess?",1.0,8,8,7,Basketball
In game dunking,"I am 15 years old, about 5'9 and weigh 145, I got my first dunk a few days ago without dribbling and a pretty big run up. What can I do to improve my dunking ability and eventually do it in a game?",0.95,36,36,12,Basketball
Need help with jumping,"Hey, I have started to work on my basketball game more, and I want to be able to jump higher, my vertical is around 17”, maybe almost 18” on a good day. I want to improve my jump a lot (I am only about 5’3”, so it is hard). I need some tips and tricks, and maybe drills and workouts to improve my jump height.",1.0,1,1,3,Basketball
"NBA Best Highlights Of The Day - August 15, 2020",,0.76,2,2,0,Basketball
Pelicans coach gentry dismissed after 5 seasons,,1.0,3,3,3,Basketball
33inch vert possible?,I’m 22 just started playing about a month ago. I’m 180cm(5’11) and have a standing reach of 232cm(7’7) so i got to have above 30 inch vert to just dunk. How hard is it to get that. Is it even possible without supreme genetics? What exercises can help? How long did it take you to grow your vert? Right now my vert is below 20 inches. HELP.,1.0,1,1,9,Basketball
Good basketball hoop?,I need a 10 ft hoop with solid backboard and rim in the uk. Price 100-200 pounds. Thanks,1.0,1,1,1,Basketball
Ball Handling Question,"Is ball handling more forearm, fingertip, etc strength OR is it more practice? I'm a good ball handler, but I wanna know if I should do less dribbling practice and more strength practice. Thanks!",1.0,1,1,2,Basketball
What kind of handles should I get?,"I'm a 5'7 Filipino boy with long arms and small hands. And as a result, I couldn't really handle the ball properly because my hands are too small to palm the ball properly with loose handles and my arms too long when doing tight handles, which means I always have a hard time choosing which type of handle I should focus on, loose handles or tight handles? I would gladly read all of your advices :)",1.0,2,2,5,Basketball
How do basketball tryouts work?,Does everyone tryout and get put on teams or do you tryout for specific teams,1.0,1,1,5,Basketball
A Triple Between the Legs Dunk,,0.5,0,0,1,Basketball
"What are some basketball terminology similar to ""shooters touch""","I am attempting to expand the basketball mixtape and media scene in Australia, and my first step is a catchy name so help a brother out.",0.84,4,4,5,Basketball
Tips for high school?,"So I’m a 12 year old 125 pound kid at 5’7 and have never played a mature game of organized basketball, I usually play 1v1s and mainly focus on shooting and dribbling, I usually practice on a 8 ft net but I want to raise it, I am decent imo, my weakness is vertical and 3s as I have never tried to shoot a 3 on regulation court, the farthest I can consistently hit is from deep mid range area. I REALLY want to play for the team in high school but not sure if I would be good enough, I can read the game pretty well and can contest shots really well, but I want to know what I should be doing to prepare and what I should be doing.:) thank you in advance",0.98,84,84,48,Basketball
INSANE Jump Stop Basketball Moves,,0.9,14,14,9,Basketball
Get better at defending clean,"Everyone tells me i am a good defender, but sometimes i just can’t keep up with my opponents speed, most times I end up fouling and fouling out early because of that, i still like to defend the most elite opponents but if i give them space they just shoot the ball and if i close out they go for the drive. Any tips on getting clean defense on elite players?",1.0,2,2,1,Basketball
What PF is Better?,"

[View Poll](https://www.reddit.com/poll/i9vobm)",1.0,3,3,4,Basketball
What muscles should i strengthen for jumpers knee?,Resting my knees for days doesnt help my jumpers knee discomfort. I figured that an imbalance in certain leg muscles is what is causing jumpers knee after basketball. What muscles might be weakrr than others? Im 6 3 have a decent vert and im skinny,1.0,1,1,1,Basketball
